{
  "schema_version": "1.0",
  "verified_at_utc": "2026-08-13T11:01:07Z",
  "purpose": "Broad, multi-domain intake of consequential published review questions for development and later time-sealed topic-rediscovery evaluation. This registry does not by itself create a blind test case.",
  "admission_policy": {
    "broad_development_intake": true,
    "strict_blind_test_is_separate": true,
    "venue_is_stratum_not_oracle": true,
    "target_identity_masking_required": true,
    "model_memory_audit_required": true,
    "family_and_time_split_required": true
  },
  "targets": [
    {
      "target_id": "nm-heat-maternal-fetal-neonatal",
      "title": "A systematic review and meta-analysis of heat exposure impacts on maternal, fetal and neonatal health",
      "publication": {
        "identity_status": "verified_primary",
        "doi": "10.1038/s41591-024-03395-8",
        "year": 2024,
        "venue": "Nature Medicine",
        "url": "https://www.nature.com/articles/s41591-024-03395-8"
      },
      "domain_ids": ["climate-health", "obstetrics", "public-health"],
      "review_family_id": "heat-pregnancy-outcomes",
      "review_type": "pairwise",
      "venue_stratum": "general_medical",
      "target_scope": "topic_only",
      "reference_question_status": "publisher_abstract_verified",
      "historical_boundary": {
        "status": "pending_primary_method_audit",
        "reported_value": null,
        "precision": "unknown",
        "source_url": "https://www.nature.com/articles/s41591-024-03395-8",
        "notes": "Identity and question are verified; normalize every source-specific search date before constructing a historical corpus."
      },
      "publication_integrity": {"status": "no_notice_found", "checked_at_utc": "2026-08-13T11:01:07Z", "related_notices": [], "benchmark_action": "use_current_version"},
      "model_memory_boundary": {"status": "unquantifiable", "memorization_probe_required": true},
      "strict_test_status": "identity_intake_only",
      "verification_sources": [
        {
          "source_type": "primary_publication",
          "url": "https://www.nature.com/articles/s41591-024-03395-8",
          "supports": "Publisher article identity, review question, review type, and journal publication."
        }
      ],
      "promotion_gaps": [
        "Audit all database search dates and define one defensible historical cutoff.",
        "Construct and leak-audit the pre-cutoff multidisciplinary evidence landscape.",
        "Freeze the question framework and run model-memory probes before testing."
      ]
    },
    {
      "target_id": "nm-obesity-pharmacotherapy-nma",
      "title": "A systematic review and meta-analysis of the efficacy and safety of pharmacological treatments for obesity in adults",
      "publication": {
        "identity_status": "verified_primary",
        "doi": "10.1038/s41591-025-03978-z",
        "year": 2025,
        "venue": "Nature Medicine",
        "url": "https://www.nature.com/articles/s41591-025-03978-z"
      },
      "domain_ids": ["endocrinology", "obesity", "pharmacotherapy"],
      "review_family_id": "adult-obesity-pharmacotherapy",
      "review_type": "network",
      "venue_stratum": "general_medical",
      "target_scope": "topic_only",
      "reference_question_status": "publisher_abstract_verified",
      "historical_boundary": {
        "status": "pending_primary_method_audit",
        "reported_value": null,
        "precision": "unknown",
        "source_url": "https://www.nature.com/articles/s41591-025-03978-z",
        "notes": "The formal identity and network meta-analysis target are verified; source-specific cutoffs remain to be normalized."
      },
      "publication_integrity": {"status": "no_notice_found", "checked_at_utc": "2026-08-13T11:01:07Z", "related_notices": [], "benchmark_action": "use_current_version"},
      "model_memory_boundary": {"status": "unquantifiable", "memorization_probe_required": true},
      "strict_test_status": "identity_intake_only",
      "verification_sources": [
        {
          "source_type": "primary_publication",
          "url": "https://www.nature.com/articles/s41591-025-03978-z",
          "supports": "Publisher article identity, adult obesity pharmacotherapy question, and network synthesis route."
        }
      ],
      "promotion_gaps": [
        "Verify the last search date and any living or update relationship.",
        "Separate drug-class concept evidence from target-review identity during corpus construction.",
        "Freeze a network-node framework and memorization probe set."
      ]
    },
    {
      "target_id": "nm-car-t-nonrelapse-mortality",
      "title": "A systematic review and meta-analysis of nonrelapse mortality after CAR T cell therapy",
      "publication": {
        "identity_status": "verified_primary",
        "doi": "10.1038/s41591-024-03084-6",
        "year": 2024,
        "venue": "Nature Medicine",
        "url": "https://www.nature.com/articles/s41591-024-03084-6"
      },
      "domain_ids": ["cell-therapy", "hematology", "oncology", "safety"],
      "review_family_id": "car-t-nonrelapse-mortality",
      "review_type": "pairwise",
      "venue_stratum": "general_medical",
      "target_scope": "topic_only",
      "reference_question_status": "publisher_abstract_verified",
      "historical_boundary": {
        "status": "pending_primary_method_audit",
        "reported_value": null,
        "precision": "unknown",
        "source_url": "https://www.nature.com/articles/s41591-024-03084-6",
        "notes": "Identity and adverse-outcome question are verified; exact search and registry cutoffs are pending."
      },
      "publication_integrity": {"status": "no_notice_found", "checked_at_utc": "2026-08-13T11:01:07Z", "related_notices": [], "benchmark_action": "use_current_version"},
      "model_memory_boundary": {"status": "unquantifiable", "memorization_probe_required": true},
      "strict_test_status": "identity_intake_only",
      "verification_sources": [
        {
          "source_type": "primary_publication",
          "url": "https://www.nature.com/articles/s41591-024-03084-6",
          "supports": "Publisher identity and review question on nonrelapse mortality after CAR T-cell therapy."
        }
      ],
      "promotion_gaps": [
        "Verify the historical search boundary and eligible treatment/product taxonomy.",
        "Construct hard negatives for relapse mortality, adverse events, and efficacy-only topics.",
        "Run identity and title-completion memorization probes."
      ]
    },
    {
      "target_id": "nee-drought-experiment-observation-biomass",
      "title": "Field experiments underestimate aboveground biomass response to drought",
      "publication": {
        "identity_status": "verified_primary",
        "doi": "10.1038/s41559-022-01685-3",
        "year": 2022,
        "venue": "Nature Ecology & Evolution",
        "url": "https://www.nature.com/articles/s41559-022-01685-3"
      },
      "domain_ids": ["climate", "ecology", "plant-biomass"],
      "review_family_id": "drought-biomass-method-comparison",
      "review_type": "mixed_quantitative",
      "venue_stratum": "topical_nature_portfolio",
      "target_scope": "topic_only",
      "reference_question_status": "publisher_abstract_verified",
      "historical_boundary": {
        "status": "pending_primary_method_audit",
        "reported_value": null,
        "precision": "unknown",
        "source_url": "https://www.nature.com/articles/s41559-022-01685-3",
        "notes": "The publisher verifies the experimental-versus-observational meta-analysis; the literature-search boundary needs method-level audit."
      },
      "publication_integrity": {
        "status": "publisher_correction",
        "checked_at_utc": "2026-08-13T11:01:07Z",
        "related_notices": [
          {
            "notice_type": "publisher_correction",
            "doi": "10.1038/s41559-022-01767-2",
            "url": "https://www.nature.com/articles/s41559-022-01767-2",
            "impact": "Corrected Figure 2a-b y-axis labels from 0, 1, 2 to 0, -1, -2; HTML and PDF were corrected."
          }
        ],
        "benchmark_action": "use_corrected_version_only"
      },
      "model_memory_boundary": {"status": "unquantifiable", "memorization_probe_required": true},
      "strict_test_status": "identity_intake_only",
      "verification_sources": [
        {
          "source_type": "primary_publication",
          "url": "https://www.nature.com/articles/s41559-022-01685-3",
          "supports": "Publisher identity, ecological question, compared evidence designs, and quantitative synthesis."
        }
      ],
      "promotion_gaps": [
        "Audit search construction and the date at which observational and experimental datasets were frozen.",
        "Represent evidence-design contrast explicitly in the target framework.",
        "Create method-comparison hard negatives that share drought and biomass terms."
      ]
    },
    {
      "target_id": "nature-energy-household-behaviour",
      "title": "A multi-country meta-analysis on the role of behavioural change in reducing energy consumption and CO2 emissions in residential buildings",
      "publication": {
        "identity_status": "verified_primary",
        "doi": "10.1038/s41560-021-00866-x",
        "year": 2021,
        "venue": "Nature Energy",
        "url": "https://www.nature.com/articles/s41560-021-00866-x"
      },
      "domain_ids": ["behaviour", "climate-mitigation", "energy", "public-policy"],
      "review_family_id": "residential-energy-behaviour",
      "review_type": "meta_regression",
      "venue_stratum": "topical_nature_portfolio",
      "target_scope": "topic_only",
      "reference_question_status": "publisher_abstract_verified",
      "historical_boundary": {
        "status": "pending_primary_method_audit",
        "reported_value": null,
        "precision": "unknown",